{
  "per_task": {
    "50e1ac9_1": {
      "success": 1,
      "step_count": 8,
      "cost_usd": 0.14,
      "num_passed": 5,
      "num_failed": 0,
      "trajectory_path": null
    },
    "50e1ac9_2": {
      "success": 0,
      "step_count": 25,
      "cost_usd": 0.52,
      "num_passed": 2,
      "num_failed": 3,
      "trajectory_path": null
    },
    "50e1ac9_3": {
      "success": 0,
      "step_count": 18,
      "cost_usd": 0.38,
      "num_passed": 1,
      "num_failed": 4,
      "trajectory_path": null
    },
    "fac291d_1": {
      "success": 1,
      "step_count": 12,
      "cost_usd": 0.22,
      "num_passed": 3,
      "num_failed": 0,
      "trajectory_path": null
    },
    "fac291d_2": {
      "success": 0,
      "step_count": 30,
      "cost_usd": 0.71,
      "num_passed": 0,
      "num_failed": 5,
      "trajectory_path": null
    }
  },
  "aggregate": {
    "n_tasks": 5,
    "n_ran": 5,
    "n_success": 2,
    "success_rate": 0.4,
    "mean_steps": 18.6,
    "total_cost_usd": 1.97
  },
  "config": {
    "tasks_dataset": "dev",
    "sample_size": 5,
    "resolved_task_ids": [
      "50e1ac9_1",
      "50e1ac9_2",
      "50e1ac9_3",
      "fac291d_1",
      "fac291d_2"
    ],
    "baseline_playbook": "experiments/playbooks/appworld_initial_playbook.txt",
    "experiment_name": "memutil_dry_run_stage1",
    "_note": "SNAPSHOT DEMO: synthetic outputs; real run would populate trajectory_path"
  },
  "config_hash": "SNAPSHOT_DEMO_stage1",
  "experiment_name": "memutil_dry_run_stage1",
  "created_at": "2026-04-23T17:14:05.752871Z"
}