{
  "per_task": {
    "50e1ac9_1": {
      "success": 0,
      "step_count": 0,
      "cost_usd": 0.0,
      "trajectory_path": null,
      "note": "no_output"
    },
    "50e1ac9_2": {
      "success": 0,
      "step_count": 0,
      "cost_usd": 0.0,
      "trajectory_path": null,
      "note": "no_output"
    },
    "50e1ac9_3": {
      "success": 0,
      "step_count": 0,
      "cost_usd": 0.0,
      "trajectory_path": null,
      "note": "no_output"
    },
    "fac291d_1": {
      "success": 0,
      "step_count": 0,
      "cost_usd": 0.0,
      "trajectory_path": null,
      "note": "no_output"
    },
    "fac291d_2": {
      "success": 0,
      "step_count": 0,
      "cost_usd": 0.0,
      "trajectory_path": null,
      "note": "no_output"
    }
  },
  "aggregate": {
    "n_tasks": 5,
    "n_ran": 0,
    "n_success": 0,
    "success_rate": 0.0,
    "mean_steps": 0.0,
    "total_cost_usd": 0.0
  },
  "config": {
    "tasks_dataset": "dev",
    "sample_size": 5,
    "task_ids_csv": null,
    "resolved_task_ids": [
      "50e1ac9_1",
      "50e1ac9_2",
      "50e1ac9_3",
      "fac291d_1",
      "fac291d_2"
    ],
    "baseline_playbook": "/home/bwoo/workspace/ace-appworld/experiments/playbooks/appworld_initial_playbook.txt",
    "experiment_name": "memutil_test_run_stage1"
  },
  "config_hash": "45bebd1872b13333a29bc8fd1894cd90ad91f67b00865b4a022a88498c4a827e",
  "experiment_name": "memutil_test_run_stage1",
  "created_at": "2026-04-24T07:20:24.133959Z"
}
